{
  "$schema": "https://json-schema.org/draft/2020-12/schema",
  "$id": "https://github.com/bvrtu/erroratlas/raw/main/data/schemas/benchmark-manifest-v2.schema.json",
  "title": "ErrorAtlas external benchmark manifest v2",
  "type": "object",
  "additionalProperties": false,
  "required": [
    "manifestVersion",
    "datasetVersion",
    "generatedAt",
    "policy",
    "repositories",
    "excludedCandidates"
  ],
  "properties": {
    "manifestVersion": {
      "const": 2
    },
    "datasetVersion": {
      "type": "string",
      "pattern": "^\\d{4}\\.\\d{2}\\.\\d{2}\\.\\d+$"
    },
    "generatedAt": {
      "$ref": "#/$defs/dateTime"
    },
    "policy": {
      "type": "object",
      "additionalProperties": false,
      "required": ["allowedLicenses", "defaultMode", "notes"],
      "properties": {
        "allowedLicenses": {
          "type": "array",
          "minItems": 1,
          "uniqueItems": true,
          "items": {
            "$ref": "#/$defs/licenseId"
          }
        },
        "defaultMode": {
          "const": "manual-full-benchmark"
        },
        "notes": {
          "type": "string",
          "minLength": 1
        }
      }
    },
    "repositories": {
      "type": "array",
      "minItems": 1,
      "maxItems": 25,
      "items": {
        "$ref": "#/$defs/repository"
      }
    },
    "excludedCandidates": {
      "type": "array",
      "items": {
        "type": "object",
        "additionalProperties": false,
        "required": ["repository", "reason"],
        "properties": {
          "repository": {
            "type": "string",
            "pattern": "^[^/]+/[^/]+$"
          },
          "reason": {
            "type": "string",
            "minLength": 1
          }
        }
      }
    }
  },
  "$defs": {
    "date": {
      "type": "string",
      "pattern": "^\\d{4}-\\d{2}-\\d{2}$"
    },
    "dateTime": {
      "type": "string",
      "pattern": "^\\d{4}-\\d{2}-\\d{2}T\\d{2}:\\d{2}:\\d{2}(?:\\.\\d+)?Z$"
    },
    "licenseId": {
      "enum": ["MIT", "Apache-2.0", "BSD-2-Clause", "BSD-3-Clause", "ISC"]
    },
    "ecosystem": {
      "enum": [
        "typescript-javascript",
        "python",
        "java",
        "go",
        "csharp",
        "kotlin",
        "openapi"
      ]
    },
    "primaryLanguage": {
      "enum": [
        "typescript",
        "javascript",
        "python",
        "java",
        "go",
        "csharp",
        "kotlin",
        "openapi"
      ]
    },
    "category": {
      "enum": [
        "typescript-express",
        "javascript-fastify",
        "typescript-next",
        "typescript-nestjs",
        "python-fastapi",
        "python-drf",
        "java-spring",
        "go-http",
        "csharp-aspnet",
        "kotlin-ktor",
        "openapi-spec"
      ]
    },
    "scanProfile": {
      "type": "object",
      "additionalProperties": false,
      "required": ["sourceIncludes", "sourceExcludes", "openapiIncludes"],
      "properties": {
        "sourceIncludes": {
          "type": "array",
          "uniqueItems": true,
          "items": {
            "type": "string",
            "minLength": 1
          }
        },
        "sourceExcludes": {
          "type": "array",
          "uniqueItems": true,
          "items": {
            "type": "string",
            "minLength": 1
          }
        },
        "openapiIncludes": {
          "type": "array",
          "uniqueItems": true,
          "items": {
            "type": "string",
            "minLength": 1
          }
        }
      }
    },
    "repository": {
      "type": "object",
      "additionalProperties": false,
      "required": [
        "id",
        "name",
        "owner",
        "repo",
        "url",
        "host",
        "commit",
        "defaultBranch",
        "license",
        "archived",
        "ecosystem",
        "primaryLanguage",
        "category",
        "framework",
        "reason",
        "scanProfile",
        "expectedLimitations",
        "addedDate",
        "lastVerifiedDate"
      ],
      "properties": {
        "id": {
          "type": "string",
          "pattern": "^[a-z0-9][a-z0-9-]*$"
        },
        "name": {
          "type": "string",
          "minLength": 1
        },
        "owner": {
          "type": "string",
          "minLength": 1
        },
        "repo": {
          "type": "string",
          "minLength": 1
        },
        "url": {
          "type": "string",
          "pattern": "^https://github\\.com/[^/]+/[^/]+$"
        },
        "host": {
          "const": "github.com"
        },
        "commit": {
          "type": "string",
          "pattern": "^[a-f0-9]{40}$"
        },
        "defaultBranch": {
          "type": "string",
          "minLength": 1
        },
        "license": {
          "type": "object",
          "additionalProperties": false,
          "required": [
            "spdxId",
            "name",
            "licenseFile",
            "sha256",
            "metadataSource"
          ],
          "properties": {
            "spdxId": {
              "$ref": "#/$defs/licenseId"
            },
            "name": {
              "type": "string",
              "minLength": 1
            },
            "licenseFile": {
              "type": "string",
              "pattern": "^(?:[^/]+|[^/]+/[^/].*)$"
            },
            "sha256": {
              "type": "string",
              "pattern": "^[a-f0-9]{64}$"
            },
            "metadataSource": {
              "enum": ["github-api", "manual-review"]
            }
          }
        },
        "archived": {
          "const": false
        },
        "ecosystem": {
          "$ref": "#/$defs/ecosystem"
        },
        "primaryLanguage": {
          "$ref": "#/$defs/primaryLanguage"
        },
        "category": {
          "$ref": "#/$defs/category"
        },
        "framework": {
          "type": "string",
          "minLength": 1
        },
        "reason": {
          "type": "string",
          "minLength": 1
        },
        "scanProfile": {
          "$ref": "#/$defs/scanProfile"
        },
        "expectedLimitations": {
          "type": "array",
          "minItems": 1,
          "uniqueItems": true,
          "items": {
            "type": "string",
            "pattern": "^[a-z0-9][a-z0-9-]*$"
          }
        },
        "addedDate": {
          "$ref": "#/$defs/date"
        },
        "lastVerifiedDate": {
          "$ref": "#/$defs/date"
        }
      }
    }
  }
}
