{
  "manifestVersion": 2,
  "datasetVersion": "2026.07.02.1",
  "generatedAt": "2026-07-02T00:00:00Z",
  "policy": {
    "allowedLicenses": [
      "MIT",
      "Apache-2.0",
      "BSD-2-Clause",
      "BSD-3-Clause",
      "ISC"
    ],
    "defaultMode": "manual-full-benchmark",
    "notes": "Full external cloning is intentionally manual; CI validates committed aggregate artifacts without network access."
  },
  "repositories": [
    {
      "id": "express-typescript-boilerplate",
      "name": "express-typescript-boilerplate",
      "owner": "w3tecch",
      "repo": "express-typescript-boilerplate",
      "url": "https://github.com/w3tecch/express-typescript-boilerplate",
      "host": "github.com",
      "commit": "17727010f7f098d8ca8b78da0a5b3c7297659381",
      "defaultBranch": "develop",
      "license": {
        "spdxId": "MIT",
        "name": "MIT License",
        "licenseFile": "LICENSE",
        "sha256": "e119e5c7536e0b1a8ec6e3f5b41b799817a02e008419309522c215b3c953712a",
        "metadataSource": "github-api"
      },
      "archived": false,
      "ecosystem": "typescript-javascript",
      "primaryLanguage": "typescript",
      "category": "typescript-express",
      "framework": "Express",
      "reason": "Existing v0.6.0 external target representing TypeScript/Express API service structure.",
      "scanProfile": {
        "sourceIncludes": ["src/**/*.{ts,tsx}"],
        "sourceExcludes": [],
        "openapiIncludes": []
      },
      "expectedLimitations": [
        "custom-error-taxonomy-may-remain-partial",
        "no-committed-erroratlas-catalog"
      ],
      "addedDate": "2026-06-21",
      "lastVerifiedDate": "2026-07-02"
    },
    {
      "id": "fastify-example",
      "name": "example",
      "owner": "fastify",
      "repo": "example",
      "url": "https://github.com/fastify/example",
      "host": "github.com",
      "commit": "30c7870a4aa448ff7839e0bd99630071ecb5b510",
      "defaultBranch": "main",
      "license": {
        "spdxId": "MIT",
        "name": "MIT License",
        "licenseFile": "LICENSE",
        "sha256": "ba9677e5a34c2738c26b36bb478f95e0369cac48fbe68a01a91fd5c7972f2043",
        "metadataSource": "github-api"
      },
      "archived": false,
      "ecosystem": "typescript-javascript",
      "primaryLanguage": "javascript",
      "category": "javascript-fastify",
      "framework": "Fastify",
      "reason": "Small official Fastify example corpus with JavaScript and TypeScript examples.",
      "scanProfile": {
        "sourceIncludes": [
          "fastify-postgres/**/*.{js,ts}",
          "validation-messages/**/*.{js,ts}",
          "typescript-decorators/src/**/*.{ts,tsx}"
        ],
        "sourceExcludes": ["**/*.test.js", "**/*.spec.ts"],
        "openapiIncludes": []
      },
      "expectedLimitations": [
        "example-app-patterns-may-not-encode-machine-readable-error-identities",
        "no-committed-erroratlas-catalog"
      ],
      "addedDate": "2026-07-02",
      "lastVerifiedDate": "2026-07-02"
    },
    {
      "id": "nextjs-vat-validation",
      "name": "nextjs-vat-validation",
      "owner": "eurovalidate",
      "repo": "nextjs-vat-validation",
      "url": "https://github.com/eurovalidate/nextjs-vat-validation",
      "host": "github.com",
      "commit": "5a419066c504653c478684bc1863e7b71843fae4",
      "defaultBranch": "main",
      "license": {
        "spdxId": "MIT",
        "name": "MIT License",
        "licenseFile": "LICENSE",
        "sha256": "7aff11a30d52c1910079861addb3093289f49b16f72d7997b532ee2bfe574149",
        "metadataSource": "github-api"
      },
      "archived": false,
      "ecosystem": "typescript-javascript",
      "primaryLanguage": "typescript",
      "category": "typescript-next",
      "framework": "Next.js",
      "reason": "Small App Router API-route example for Next.js response-surface validation.",
      "scanProfile": {
        "sourceIncludes": ["app/**/*.{ts,tsx}"],
        "sourceExcludes": [],
        "openapiIncludes": []
      },
      "expectedLimitations": [
        "small-example-repository",
        "no-committed-erroratlas-catalog"
      ],
      "addedDate": "2026-07-02",
      "lastVerifiedDate": "2026-07-02"
    },
    {
      "id": "nestjs-prisma-starter",
      "name": "nestjs-prisma-starter",
      "owner": "notiz-dev",
      "repo": "nestjs-prisma-starter",
      "url": "https://github.com/notiz-dev/nestjs-prisma-starter",
      "host": "github.com",
      "commit": "225e5a906865df237a681c1ad228a3ecf2909326",
      "defaultBranch": "main",
      "license": {
        "spdxId": "MIT",
        "name": "MIT License",
        "licenseFile": "LICENSE",
        "sha256": "82b345e68af0e0bd9f6bc7394e79a975e2714b0ba0c6df6c298222c9b1d1d914",
        "metadataSource": "github-api"
      },
      "archived": false,
      "ecosystem": "typescript-javascript",
      "primaryLanguage": "typescript",
      "category": "typescript-nestjs",
      "framework": "NestJS",
      "reason": "NestJS starter with a larger application structure and API-adjacent service/resolver code.",
      "scanProfile": {
        "sourceIncludes": ["src/**/*.ts"],
        "sourceExcludes": ["**/*.spec.ts"],
        "openapiIncludes": []
      },
      "expectedLimitations": [
        "graphql-heavy-surfaces-may-not-look-like-http-error-responses",
        "no-committed-erroratlas-catalog"
      ],
      "addedDate": "2026-07-02",
      "lastVerifiedDate": "2026-07-02"
    },
    {
      "id": "fastapi-clean-architecture-example",
      "name": "fastapi-clean-architecture-example",
      "owner": "1owkeyme",
      "repo": "fastapi-clean-architecture-example",
      "url": "https://github.com/1owkeyme/fastapi-clean-architecture-example",
      "host": "github.com",
      "commit": "e317f7b7843e4b9f1bf8157b29f224d2d34f3d11",
      "defaultBranch": "main",
      "license": {
        "spdxId": "MIT",
        "name": "MIT License",
        "licenseFile": "LICENSE",
        "sha256": "532f8819e3f081a7cff3072431c2e84a677df58e8cf43a1c2b201ec4b707bcab",
        "metadataSource": "github-api"
      },
      "archived": false,
      "ecosystem": "python",
      "primaryLanguage": "python",
      "category": "python-fastapi",
      "framework": "FastAPI",
      "reason": "Existing v0.6.0 FastAPI-style Python API target.",
      "scanProfile": {
        "sourceIncludes": ["src/**/*.py"],
        "sourceExcludes": [],
        "openapiIncludes": []
      },
      "expectedLimitations": [
        "custom-domain-exceptions-may-remain-partial",
        "no-committed-erroratlas-catalog"
      ],
      "addedDate": "2026-06-21",
      "lastVerifiedDate": "2026-07-02"
    },
    {
      "id": "drf-tdd-example",
      "name": "DRF-TDD-example",
      "owner": "erdem",
      "repo": "DRF-TDD-example",
      "url": "https://github.com/erdem/DRF-TDD-example",
      "host": "github.com",
      "commit": "50d014512045f59b99fcb6b1a93506724d771c60",
      "defaultBranch": "master",
      "license": {
        "spdxId": "MIT",
        "name": "MIT License",
        "licenseFile": "LICENSE",
        "sha256": "de72ac628d482ac83b74d597fbabdeda527a5ffedf9244b17af77ea4f97ad48b",
        "metadataSource": "github-api"
      },
      "archived": false,
      "ecosystem": "python",
      "primaryLanguage": "python",
      "category": "python-drf",
      "framework": "Django REST Framework",
      "reason": "Small Django REST Framework API example to broaden Python coverage beyond FastAPI.",
      "scanProfile": {
        "sourceIncludes": ["todoapp/**/*.py"],
        "sourceExcludes": ["**/migrations/**/*.py"],
        "openapiIncludes": []
      },
      "expectedLimitations": [
        "framework-validation-errors-may-not-use-machine-readable-codes",
        "no-committed-erroratlas-catalog"
      ],
      "addedDate": "2026-07-02",
      "lastVerifiedDate": "2026-07-02"
    },
    {
      "id": "spring-gs-rest-service",
      "name": "gs-rest-service",
      "owner": "spring-guides",
      "repo": "gs-rest-service",
      "url": "https://github.com/spring-guides/gs-rest-service",
      "host": "github.com",
      "commit": "e9efc9dfa0abe8cf8e15cf0e71830b5125322cae",
      "defaultBranch": "main",
      "license": {
        "spdxId": "Apache-2.0",
        "name": "Apache License 2.0",
        "licenseFile": "LICENSE.txt",
        "sha256": "56dfc19e0dc836e30177332f73e8e6fbc297941acf3d906eec6eaaa46c2c452a",
        "metadataSource": "github-api"
      },
      "archived": false,
      "ecosystem": "java",
      "primaryLanguage": "java",
      "category": "java-spring",
      "framework": "Spring Web",
      "reason": "Existing v0.6.0 Spring Web API guide target.",
      "scanProfile": {
        "sourceIncludes": ["complete/src/**/*.java"],
        "sourceExcludes": [],
        "openapiIncludes": []
      },
      "expectedLimitations": [
        "guide-style-happy-path-service-may-have-zero-error-contracts",
        "no-committed-erroratlas-catalog"
      ],
      "addedDate": "2026-06-21",
      "lastVerifiedDate": "2026-07-02"
    },
    {
      "id": "go-rest-api",
      "name": "go-rest-api",
      "owner": "benc-uk",
      "repo": "go-rest-api",
      "url": "https://github.com/benc-uk/go-rest-api",
      "host": "github.com",
      "commit": "094fa3864d140244909281dc903a9ace4c788d30",
      "defaultBranch": "main",
      "license": {
        "spdxId": "MIT",
        "name": "MIT License",
        "licenseFile": "LICENSE",
        "sha256": "7597f18bd749d75734437d940edbee9cb4e22984fe8d7f2b6787325ecf3e3a4e",
        "metadataSource": "github-api"
      },
      "archived": false,
      "ecosystem": "go",
      "primaryLanguage": "go",
      "category": "go-http",
      "framework": "net/http",
      "reason": "Existing v0.6.0 Go HTTP API target with conventional returned errors.",
      "scanProfile": {
        "sourceIncludes": ["{cmd,pkg}/**/*.go"],
        "sourceExcludes": [],
        "openapiIncludes": []
      },